"id";"title";"authors";"subjectsPOR";"institutions";"types";"accesslevel";"publicationDates";"urls";"formats";"languages";
"UFPE_f71a736d831b5d5ed1ae6d42d2052d07";"Variants of the Fast Adaptive Stacking of Ensembles algorithm";"primary[MARIÑO, Laura María Palomino(NA)]";"Inteligência artificial|Mudanças de conceito|Fluxo de dados|Métodos de Combinação de Classificadores";"UFPE";"masterThesis";"openAccess";"2019";"https://repositorio.ufpe.br/handle/123456789/36042";"masterThesis";"por"
"UFPE_851ae9980ee25cdf9a5e0875162c13f3";"Eficiência energética no controle inteligente de sistemas de bombeamento";"primary[Filipe Alves Cordeiro, Luiz(NA)]";"Automação Industrial|Eficiência Energética|Inteligência Artificial|Sistemas de Bombeamento";"UFPE";"masterThesis";"openAccess";"2008";"https://repositorio.ufpe.br/handle/123456789/5288";"masterThesis";"por"
"UFPE_203fc8f677de17dee042e42a0fdd42ab";"Conversão de provas em lógica de descrições ALC geradas pelo método de conexões para sequentes";"primary[SILVA, Eunice Palmeira da(NA)]";"Ciência da computação|Teoria da computação|Inteligência artificial|Raciocínio automático";"UFPE";"doctoralThesis";"openAccess";"2017";"https://repositorio.ufpe.br/handle/123456789/28362";"doctoralThesis";"por"
"UFPE_e74b1f62d898497dcd22869a60b09dd5";"Mineração de opiniões baseada em aspectos para revisões de medicamentos";"primary[CAVALCANTI, Diana Cabral(NA)]";"Inteligência artificial|Mineração de opiniões|Recuperação da informação|Revisões de medicamentos";"UFPE";"doctoralThesis";"embargoedAccess";"2017";"https://repositorio.ufpe.br/handle/123456789/25854";"doctoralThesis";"por"
"UFPE_bb46240d0d5fef47af874d1c46ae502e";"A solution to extractive summarization based on document type and a new measure for sentence similarity";"primary[MELLO, Rafael Ferreira Leite de(NA)]";"Ciência da computação|Inteligência artificial|Mineração de texto|Processamento de linguagem natural";"UFPE";"doctoralThesis";"openAccess";"2015";"https://repositorio.ufpe.br/handle/123456789/15257";"doctoralThesis";"por"
"UFPE_371b472cf19703932d09fa431c70b04d";"Detecção de intrusão em redes de computadores: uma abordagem usando extreme learning machines";"primary[Paiva Medeiros de Farias, Gilles(NA)]";"Redes Neurais Artificiais|Inteligência Artificial|Redes de computadores|IDS";"UFPE";"masterThesis";"openAccess";"2011";"https://repositorio.ufpe.br/handle/123456789/2820";"masterThesis";"por"
"UFPE_97b52111ae26d2b11443dfd9200ada91";"Aumento de escalabilidade no simulador de jogos RTS - RTSCUP";"primary[LOBO, Rodrigo Araújo(NA)]";"Inteligência artificial|Sistemas multiagentes|Simulador|RTS|Jogos|Escalabilidade|Desempenho";"UFPE";"masterThesis";"openAccess";"2010";"https://repositorio.ufpe.br/handle/123456789/2741";"masterThesis";"por"
"UFPE_b2d00cb74cc9c6f1bab70da36cb8478c";"Auto-organização e aprendizagem por demonstração na determinação de marcha robótica";"primary[SANTANA JÚNIOR, Orivaldo Vieira de(NA)]";"Inteligência artificial|Redes neurais|Mapas autoorganizáveis|Robôs móveis";"UFPE";"masterThesis";"openAccess";"2015";"https://repositorio.ufpe.br/handle/123456789/14928";"masterThesis";"por"
"UFPE_0cf3e87f719182daebcac25a6eace59c";"Uma avaliação da influência dos modelos de propagação de sinais de rádio frequência no desempenho de uma aplicação de segurança usando o simulador Veins";"primary[REIS, Denis Paulo Costa(NA)]";"Inteligência artificial|Redes veiculares|Sistemas inteligentes de veículos rodoviários";"UFPE";"masterThesis";"openAccess";"2017";"https://repositorio.ufpe.br/handle/123456789/26719";"masterThesis";"por"
"UFPE_a63aea858ad19ea5998901c5231fc063";"Previsão de séries temporais na presença de mudança de conceito: uma abordagem baseada em PSO";"primary[OLIVEIRA, Gustavo Henrique Ferreira de Miranda(NA)]";"Inteligência artificial|Previsão de séries temporais|Redes neurais artificiais";"UFPE";"masterThesis";"openAccess";"2018";"https://repositorio.ufpe.br/handle/123456789/29987";"masterThesis";"por"
"UFPE_34e536b20ce7cd341689ce1c1411e2b7";"Sumarização automática de textos baseada em conceitos via programação linear inteira e regressão";"primary[OLIVEIRA, Hilário Tomaz Alves de(NA)]";"Inteligência artificial|Processamento de linguagem natural|Mineração de texto|Sumarização automática de texto";"UFPE";"doctoralThesis";"embargoedAccess";"2018";"https://repositorio.ufpe.br/handle/123456789/30618";"doctoralThesis";"por"
"UFPE_96a78da9f0019fcbc622983fd6e8217c";"Gerenciador de recursos em ambientes complexos: uma aplicação aos jogos de estratégia em tempo real";"primary[Souza, Thiago de Andrade(NA)]";"Ciência da computação|Inteligência artificial|Jogos digitais|Gerenciamento de recursos";"UFPE";"masterThesis";"openAccess";"2013";"https://repositorio.ufpe.br/handle/123456789/12442";"masterThesis";"por"
"UFPE_59a9639ec1360499e1c186c423de2312";"Um sistema de extração de informação em referências bibliográficas baseado em aprendizagem e máquina";"primary[Fraga do Amaral e Silva, Eduardo(NA)]";"Extração de Informação, Wrappers, Aprendizagem de Máquina, Classificação de Textos, HMM, Inteligência Artificial.";"UFPE";"masterThesis";"openAccess";"2004";"https://repositorio.ufpe.br/handle/123456789/2498";"masterThesis";"por"
"UFPE_b23783707fa63c6449a3f088880a199c";"DBSitter: um sistema inteligente para gerencimaneto de SGBD";"primary[CAVALCANTI, Adriana Paula Carneiro(NA)]";"Gerenciamento e monitoração de SGBD|Agentes Inteligentes|Raciocínio Baseado em Casos|Inteligência Artificial";"UFPE";"masterThesis";"openAccess";"2005";"https://repositorio.ufpe.br/handle/123456789/2771";"masterThesis";"por"
"UFPE_19f587f88468e265f297bd40760b5c95";"Swarm optimization clustering methods for opinion mining";"primary[SOUZA, Ellen Polliana Ramos(NA)]";"Inteligência artificial|Mineração de opinião|Agrupamento de opinião|Otimização de enxame";"UFPE";"doctoralThesis";"openAccess";"2017";"https://repositorio.ufpe.br/handle/123456789/25227";"doctoralThesis";"eng"
"UFPE_4b1b76531603129eb6e36b70a98aeb41";"Diretrizes para construção de modelos preditivos de abandono de usuário em jogos móveis";"primary[VIEIRA FILHO, Vicente(NA)]";"Inteligência Artificial|Jogos Móveis|Previsão de Abandono|Mineração de dados";"UFPE";"doctoralThesis";"openAccess";"2017";"https://repositorio.ufpe.br/handle/123456789/30496";"doctoralThesis";"por"
"UFPE_abebd07de709a68c0174816fb0a757f3";"Análise quantitativa de imagens médicas funcionais utilizando métodos de reconhecimento de padrões e inteligência artificial";"primary[VIEIRA, Igor Fagner(NA)]";"Ressonância magnética|DWI|Inteligência artificial|Textura não-adaptativa|Textura adaptativa";"UFPE";"doctoralThesis";"embargoedAccess";"2018";"https://repositorio.ufpe.br/handle/123456789/29725";"doctoralThesis";"por"
"UFPE_24daac1798456d99acecac000c99ed8a";"NLForSpec : uma ferramenta para geração de especificações formais a partir de casos de teste em linguagem natural";"primary[LEITÃO, Daniel Almeida(NA)]";"Interpretação de linguagem natural|Especificações de casos de teste|Inteligência artificial simbólica";"UFPE";"masterThesis";"openAccess";"2006";"https://repositorio.ufpe.br/handle/123456789/2583";"masterThesis";"por"
"UFPE_44288595d484b8d6e74805aad545f92f";"Visão computacional e segmentação de imagens por discriminação de textura";"primary[GOMES, Daniel de Filgueiras(NA)]";"Visão computacional|Inteligência artificial|Processamento de imagens|Segmentação de textura|Discriminação de textura";"UFPE";"masterThesis";"openAccess";"2009";"https://repositorio.ufpe.br/handle/123456789/2244";"masterThesis";"por"
"UFPE_a0d2752caade99e884770781c7fa123a";"SpecNL : uma ferramenta para gerar descrições em linguagem natural a partir de especificações de casos de teste";"primary[TORRES, Dante Gama(NA)]";"Geração de linguagem natural|Especificações de casos de teste|Inteligência artificial simbólica";"UFPE";"masterThesis";"openAccess";"2006";"https://repositorio.ufpe.br/handle/123456789/2585";"masterThesis";"por"
"UFPE_e6fabca935197490f3896a85c6362c78";"Busca e recuperação de componentes de software utilizando agrupamento de componentes";"primary[Veras, Ronaldo Cisneiros(NA)]";"Software|Reuso de Software|Aprendizagem de Máquina|Agrupamento|Inteligência Artificial|Engenharia de Software";"UFPE";"masterThesis";"openAccess";"2008";"https://repositorio.ufpe.br/handle/123456789/2110";"masterThesis";"por"
"UFPE_81eabde4a23ad0ba39f8d2cf1cbd60db";"Aplicação de redes neurais para diagnósticos de poluição em isoladores de alta tensão";"primary[Seabra Melo e Santos, Gabriela(NA)]";"Inteligência Artificial|Poluição em Isoladores|Classificador de padroes|Ultra-som|Descargas superficiais";"UFPE";"masterThesis";"openAccess";"2008";"https://repositorio.ufpe.br/handle/123456789/5243";"masterThesis";"por"
"UFPE_6b814c6fcd5ef77c4f6c65ee79112f45";"Extração de informação usando integração de componentes de PLN através do framework GATE";"primary[de Souza Cabral, Luciano(NA)]";"Inteligência Artificial|Extração de Informação|Processamento de Linguagem Natural|Ontologias";"UFPE";"masterThesis";"openAccess";"2009";"https://repositorio.ufpe.br/handle/123456789/1927";"masterThesis";"por"
"UFPR_8c10f81b0e45e2afa1b5e1cfe91c084d";"Abordagens de aprendizado de máquina aplicadas à classificação de dados provenientes de equipamento ekletroencefalográfico não-invasivo";"primary[Santos, Alisson Ravaglio(NA)]";"Engenharia elétrica|Eletroencefalografia|Pendulo|Redes neurais (Computação)|Inteligencia artificial|Teses";"UFPR";"masterThesis";"openAccess";"2017";"https://hdl.handle.net/1884/53435";"masterThesis";"por"
"UFPR_c54ebd71b0d1549a1cc5bdaa237a381f";"Ao redor dos sistemas";"primary[Urban, Antonio Edison(NA)]|secondary[Direne, Alexandre Ibrahim(NA)]";"Teses|Sistemas de recuperação da informação|Sistemas tutoriais inteligentes|Inteligencia artificial";"UFPR";"masterThesis";"openAccess";"2010";"http://hdl.handle.net/1884/24763";"masterThesis";"por"
"UFPR_abcf7650ce17e1d3fa633bd59ad38534";"Petrigraph : um algoritmo para planejamento por desdobramento de redes de Petri";"primary[Töws, Guilherme Stutz(NA)]";"Teses|Algoritmos|Redes de petri|Inteligência artificial|Ciencia da Computação";"UFPR";"masterThesis";"openAccess";"2008";"https://hdl.handle.net/1884/16263";"masterThesis";"por"
"UFPR_780b8d27231fb4c9a75039ee4ded7685";"Causalidade e dependência em raciocínio sobre ações";"primary[Varzinczak, Ivan José(NA)]";"Teses|Lógica simbólica e matemática|Inteligência artificial|Ciencia da Computação";"UFPR";"masterThesis";"openAccess";"2002";"https://hdl.handle.net/1884/111";"masterThesis";"por"
"UFPR_01243fac37391445e4369cd84dc96a92";"Conceitos e ferramentas de autoria para representação da visão estratégica baseada em padrões e busca em jogos heurísticos adversaristas";"primary[Bueno, Luís Carlos Ferreira(NA)]";"Inteligência artificial|Ciência da Computação|Reconhecimento de padrões|Jogos educativos";"UFPR";"doctoralThesis";"openAccess";"2018";"https://hdl.handle.net/1884/59667";"doctoralThesis";"por"
"UFPR_888854653da53ea4e3e7086eabe321d2";"Um ambiente de interface e interação para um servidor de xadrez on-line na web como uma ferramenta educacional";"primary[Picussa, Juliano(NA)]|secondary[García, Laura Sánchez, 1957-(NA)|Universidade Federal do Paraná. Setor de Ciencias Exatas. Programa de Pós-Graduaçao em Informática(NA)]";"Teses|Xadrez - Estudo e ensino|Inteligencia artificial - Aplicações educacionais";"UFPR";"masterThesis";"openAccess";"2009";"http://hdl.handle.net/1884/18127";"masterThesis";"por"
"UFPR_390f865011059050bedbb89e5878d1be";"Treasure hunt : a framework for cooperative, distributed parallel optimization";"primary[Perroni, Peter Frank, 1977-(NA)]";"Inteligencia artificial - Processamento de dados|Algoritmos de computador|Ciência da Computação";"UFPR";"doctoralThesis";"openAccess";"2019";"https://hdl.handle.net/1884/62517";"doctoralThesis";""
"UFPR_ddd960e46d60970b563a646f571bff30";"Spatio-temporal centroid based sign language facial expressions for animation synthesis in virtual environment";"primary[Gonçalves, Diego Addan, 1985-(NA)]";"Língua brasileira de sinais|Ciência da Computação|Expressão facial|Inteligência artificial";"UFPR";"doctoralThesis";"openAccess";"2019";"https://hdl.handle.net/1884/60182";"doctoralThesis";"por"
"UFPR_aed65a10b2aa5f2b03e298dad61d390f";"Aplicação da inteligência artificial na anotação automática de genomas bacterianos";"primary[Tibães, Juliana Helena(NA)]";"Teses|Inteligencia artificial|Seqüencia de nucleotidios|Bioinformática|Ciencia da computação";"UFPR";"masterThesis";"openAccess";"2012";"http://hdl.handle.net/1884/28826";"masterThesis";"por"
"UFPR_b10a7d8c06b79869e47b800817c87f9b";"SISMAT";"primary[Mathias, Ivo Mario(NA)]";"Teses|Inteligencia artificial distribuida|Programação orientada a objetos (Computação)";"UFPR";"masterThesis";"openAccess";"2011";"http://hdl.handle.net/1884/25095";"masterThesis";"por"
"UFPR_656f5fa26249fa415f1a566b371f249c";"Análise de layout de página em jornais históricos germano-brasileiros";"primary[Araújo, Alessandra Belézia, 1989-(NA)]";"Redes neurais (Computação)|Algorítmos de computador|Inteligência artificial|Ciência da Computação";"UFPR";"masterThesis";"openAccess";"2019";"https://hdl.handle.net/1884/63706";"masterThesis";"por"
"UFPR_f387b0fe5344e823b43cd9dcd1056638";"A tutela jurídica de trabalhos criativos feitos por aplicações de inteligência artificial no Brasil";"primary[Gonçalves, Lukas Ruthes(NA)]";"Direitos autorais|Direito|Inteligência artificial|Sociedade da informação|Software";"UFPR";"masterThesis";"openAccess";"2019";"https://hdl.handle.net/1884/60345";"masterThesis";"por"
"UFPR_e77593d250bd20cc5066caaea4f81f33";"Definição de atores e seus papéis em um ambiente virtual para aprendizagem e prática do xadrez escolar";"primary[Kuss, Fabiano Sardenberg(NA)]";"Teses|Inteligencia artificial - Aplicações educacionais|Xadrez - Estudo e ensino|Informática na educação";"UFPR";"masterThesis";"openAccess";"2011";"http://hdl.handle.net/1884/26400";"masterThesis";"por"
"UFPR_dedb5a6157ff02644e8b5b152ecf6cb2";"Algoritmos evolutivos com tratamento de restrições aplicados ao problema de planejamento do despacho hidrotérmico";"primary[Marcondes, Eduardo João(NA)]";"Algoritmos de computador|Inteligência artificial|Ciência da Computação|Usinas hidreletricas";"UFPR";"masterThesis";"openAccess";"2019";"https://hdl.handle.net/1884/62080";"masterThesis";"por"
"UFPR_09ec0f63174db923114e982de2790ea1";"Dependency rank : método de priorização de requisitos baseado nas relações de dependência identificadas por PLN";"primary[Generoso, Marlon André Peron(NA)]";"Engenharia de software|Software - Desenvolvimento|Inteligência artificial|Ciência da Computação";"UFPR";"masterThesis";"openAccess";"2019";"https://hdl.handle.net/1884/61379";"masterThesis";"por"
"UFPR_2aeb372b12fb2a35a0b95570d0efc161";"Aplicação de técnicas de aprendizado de máquina na mensuração florestal";"primary[Rojas Montaño, Razer Anthom Nizer(NA)]";"Ciência da computação|Inventario florestal|Redes neurais (Computação)|Inteligencia artificial|Teses";"UFPR";"doctoralThesis";"openAccess";"2016";"http://hdl.handle.net/1884/45346";"doctoralThesis";"por"
"UFPR_2cbd7981c7c79a46d40c55ca390cfb01";"Detecção de outliers no espaço semântico aplicada à análise de sentimento por redes neurais convolucionais";"primary[Schmitt, Murilo Falleiros Lemos(NA)]";"Redes neurais (Computação)|Ciência da Computação|Algoritmos de computador|Inteligência artificial|Teses";"UFPR";"masterThesis";"openAccess";"2018";"https://hdl.handle.net/1884/58196";"masterThesis";"por"
"UFPR_b111a5ed73695ae229d6d0b1348cc8f9";"Gherkin Specification Extension : uma linguagem de especificação de requisitos baseada em Gherkin";"primary[Ehrenfried, Henrique Varella, 1995-(NA)]";"Processamento da linguagem natural (Computação)|Ciência da Computação|Inteligência artificial|Software - Desenvolvimento";"UFPR";"masterThesis";"openAccess";"2019";"https://hdl.handle.net/1884/60248";"masterThesis";"por"
"UFPR_5eddd6902e58dbf312ab63fecd3c0a13";"Point spread function estimation of solar surface images with a cooperative particle swarm optmization on GPUS";"primary[Perroni, Peter Frank(NA)]";"Teses|Algoritmos - Inteligencia artificial - Particulas|Imagens digitais|Luz - Espalhamento";"UFPR";"masterThesis";"openAccess";"2013";"http://hdl.handle.net/1884/30081";"masterThesis";""
"UFPR_c1ee6ba3b76e8cfae29cce6801f78c66";"Conexão de geração distribuída em redes de distribuição";"primary[Souza, Angelo Ricardo Rodrigues de(NA)]";"Teses|Energia elétrica - Distribuição|Inteligencia artificial|Otimização combinatoria";"UFPR";"masterThesis";"openAccess";"2009";"http://hdl.handle.net/1884/19160";"masterThesis";"por"
"UFPR_5ef855a3b1383c2bd942dc822a69bdc2";"Uma especialização do Yolov3 para detecção de pedestres";"primary[Valiati, Gustavo Rafael(NA)]";"Ciência da Computação|Visão por computador|Inteligência artificial|Redes neurais (Computação)";"UFPR";"masterThesis";"openAccess";"2019";"https://hdl.handle.net/1884/59953";"masterThesis";""
"ITA_5bd93b66c164525d4b1f4aec9b3c0b01";"Planejamento online para robô móvel baseado em amostragem esparsa e macro-operadores.";"primary[Celeny Fernandes Alves(NA)]";"Dinâmica de robôs|Planejamento de tarefas (robótica)|Aprendizagem|Amostragem|Inteligência artificial|Computação";"ITA";"masterThesis";"openAccess";"2007";"http://www.bd.bibl.ita.br/tde_busca/arquivo.php?codArquivo=382";"masterThesis";"por"
"ITA_2e2e5a5e7e773521ba1b6f7e48fd3e22";"Influência da topologia e da reputação na convergência em modelos do Naming Game.";"primary[Thaís Gobet Uzun(NA)]";"Sistemas multiagentes|Redes complexas|Convergência (matemática)|Inteligência artificial|Computação";"ITA";"masterThesis";"openAccess";"2010";"http://www.bd.bibl.ita.br/tde_busca/arquivo.php?codArquivo=1131";"masterThesis";"por"
"ITA_afa27f5a64ba674f9014b183ce7203a8";"Processamento automático aplicado à análise de requisitos escritos em linguagem natural";"primary[Samir Prado Daud(NA)]";"Processamento da linguagem natural|Requisitos|Inteligência artificial|Semântica|Sintaxe|Computação";"ITA";"masterThesis";"openAccess";"2009";"http://www.bd.bibl.ita.br/tde_busca/arquivo.php?codArquivo=1280";"masterThesis";"por"
"ITA_22195850a4a266ba76965962fa596d73";"Identificação de sistemas dinâmicos via redes neurais artificiais.";"primary[José Alfredo Ruiz Vargas(NA)]";"Redes neurais|Sistemas dinâmicos|Inteligência artificial|Algoritmos|Computação";"ITA";"masterThesis";"openAccess";"1997";"http://www.bd.bibl.ita.br/tde_busca/arquivo.php?codArquivo=1375";"masterThesis";"por"
"ITA_4730a2069ac20156b150bff2a6b97426";"Uma arquitetura para agentes autônomos móveis sob a visão da inteligência artificial distribuída.";"primary[Claudio Cesar de Sá(NA)]";"Inteligência artificial|Sistemas distribuídos|Robótica|Arquitetura (computadores)|Computação";"ITA";"doctoralThesis";"openAccess";"1997";"http://www.bd.bibl.ita.br/tde_busca/arquivo.php?codArquivo=1368";"doctoralThesis";"por"
"ITA_7dd93495af6ec291334b03c3df5d2619";"Modelo de rede neuronal aplicado ao reconhecimento de fonemas vocálicos presentes em um vocabulário de comando";"primary[Plínio Almeida Barbosa(NA)]";"Inteligência artificial|Reconhecimento de padrões|Reconhecimento de voz|Redes neurais|Telecomunicações|Computação";"ITA";"masterThesis";"openAccess";"1990";"http://www.bd.bibl.ita.br/tde_busca/arquivo.php?codArquivo=1450";"masterThesis";"por"
"ITA_152fd8bb0b946961d00f92bbd2aefa3f";"Implementação de um ambiente para tratamento inteligente de sinais cardiográficos";"primary[Luís Fernando Faina(NA)]";"Inteligência artificial|Sistemas especialistas|Bioengenharia|Eletrocardiografia|Computação|Medicina";"ITA";"masterThesis";"openAccess";"1990";"http://www.bd.bibl.ita.br/tde_busca/arquivo.php?codArquivo=1448";"masterThesis";"por"
"ITA_84116743eb5ab117e819f36ed83dbc63";"Estudo de um modelo para reconhecimento de voz baseado em discriminação acústico-fonética";"primary[Rafael Michelin Laboissiére(NA)]";"Inteligência artificial|Reconhecimento de voz|Processamento de sinais|Reconhecimento de padrões|Computação|Telecomunicações";"ITA";"masterThesis";"openAccess";"1988";"http://www.bd.bibl.ita.br/tde_busca/arquivo.php?codArquivo=1511";"masterThesis";"por"
"ITA_5c81fd5829ef234450da316eb5979f30";"Estudo de algoritmos com chaveamento para o treinamento de redes neurais artificiais em problemas de reconhecimento de padrões";"primary[Eduardo de Azevedo Botter(NA)]";"Redes neurais|Reconhecimento de padrões|Algoritmos|Inteligência artificial|Eletrocardiografia|Computação";"ITA";"masterThesis";"openAccess";"1996";"http://www.bd.bibl.ita.br/tde_busca/arquivo.php?codArquivo=1592";"masterThesis";"por"
"ITA_a195141f498d2752f9d2044ca42014ed";"Um protótipo de sistema especialista para o suporte a operação e manutenção do monitor de lastro Oili 1000 de navios petroleiros";"primary[Ricardo de Oliveira Alves(NA)]";"Sistemas especialistas|Inteligência artificial|Representação do conhecimento|Poluição|Embarcações|Mares|Computação";"ITA";"masterThesis";"openAccess";"1996";"http://www.bd.bibl.ita.br/tde_busca/arquivo.php?codArquivo=1637";"masterThesis";"por"
"ITA_a6bb8e883625c6dfc55d6213c17f2645";"Redução do erro de classificação de redes neurais aplicada ao reconhecimento de fonemas multilocutor";"primary[Alexandre Girardi(NA)]";"Redes neurais|Reconhecimento de padrões|Reconhecimento de voz|Inteligência artificial|Computação";"ITA";"masterThesis";"openAccess";"1992";"http://www.bd.bibl.ita.br/tde_busca/arquivo.php?codArquivo=1705";"masterThesis";"por"
"ITA_51675920819611b3b90bf593a820eda0";"Um sistema especialista para supervisão on-line de fornos de aquecimento de petróleo";"primary[Yván Jésus García López(NA)]";"Sistemas especialistas|Inteligência artificial|Fornos|Controle de processos|Computação";"ITA";"masterThesis";"openAccess";"1992";"http://www.bd.bibl.ita.br/tde_busca/arquivo.php?codArquivo=1775";"masterThesis";"por"
"ITA_35b13b44aff7f410eab7dcffe81dcc53";"Metodologias para processamento inteligente de alarmes";"primary[Alexandre Carlos Brandão Ramos(NA)]";"Processamento de sinais|Inteligência artificial|Reconhecimento de padrões|Sistemas especialistas|Computação";"ITA";"masterThesis";"openAccess";"1992";"http://www.bd.bibl.ita.br/tde_busca/arquivo.php?codArquivo=1790";"masterThesis";"por"
"ITA_48309c9a91b84950efc873818ad308f3";"PATHO - Sistema especialista para apoio ao diagnóstico em sarcomas ósseos";"primary[Raquel Dias Mendes(NA)]";"Sistemas especialistas|Sarcoma osteogenico|Diagnósticos|Inteligência artificial|Computação|Medicina";"ITA";"masterThesis";"openAccess";"1991";"http://www.bd.bibl.ita.br/tde_busca/arquivo.php?codArquivo=1848";"masterThesis";"por"
"ITA_0a537be2edd604924fa8a460470c14f5";"Um sistema de processamento de imagens, que utiliza sistemas especialistas para auxiliar na interpretação";"primary[Renato Moreira Hadad(NA)]";"Processamento de imagens|Imagens|Processamento fotográfico|Inteligência artificial|Engenharia eletrônica";"ITA";"masterThesis";"openAccess";"1992";"http://www.bd.bibl.ita.br/tde_busca/arquivo.php?codArquivo=1855";"masterThesis";"por"
"ITA_722c4f1709ae4a1435880fba7a6b3e1a";"Uma arquitetura adaptativa para tomada de decisões em jogos eletrônicos";"primary[Emanuel Mineda Carneiro(NA)]";"Inteligência artificial|Tomada de decisões|Jogos computacionais|Entretenimento|Computação";"ITA";"masterThesis";"openAccess";"2013";"http://www.bd.bibl.ita.br/tde_busca/arquivo.php?codArquivo=2261";"masterThesis";"por"
"ITA_d7718b00a7177f4ffeb3f2557cb7dcff";"Um modelo de sistema educativo cognitivista baseado em tutoria inteligente adaptativa via aderência conceitual.";"primary[Aury de Sá Leite(NA)]";"Inteligência artificial|Aprendizagem|Psicologia educacional|Representação do conhecimento|Pedagogia|Computação|Educação";"ITA";"doctoralThesis";"openAccess";"1999";"http://www.bd.bibl.ita.br/tde_busca/arquivo.php?codArquivo=2340";"doctoralThesis";"por"
"ITA_9b85c7d5f15aac91751040ac620f0c7e";"Definição dinâmica de estratégias instrucionais em sistemas de tutoria inteligente: uma abordagem multiagentes na WWW.";"primary[Maria das Graças Bruno Marietto(NA)]";"Inteligência artificial|Sistemas distribuídos|Arquitetura (computadores)|Aprendizagem|Computação|Educação";"ITA";"doctoralThesis";"openAccess";"2000";"http://www.bd.bibl.ita.br/tde_busca/arquivo.php?codArquivo=2375";"doctoralThesis";"por"
"ITA_72b3a2f8e1d38bdbcd5cdf8e6d2219f9";"Utilização de aprendizado por reforço para modelagem autônoma do aprendiz em sistemas tutores inteligentes.";"primary[Marcus Vinicius Carvalho Guelpeli(NA)]";"Arquitetura (computadores)|Algoritmos|Aprendizagem|Inteligência artificial|Programas de sistemas de computadores|Computação";"ITA";"masterThesis";"openAccess";"2003";"http://www.bd.bibl.ita.br/tde_busca/arquivo.php?codArquivo=2733";"masterThesis";"por"
"ITA_213c9a115a268f81b6f847d3d956ac08";"Modelo conceitual formal de relacionamentos do ordenamento jurídico positivo";"primary[Alexandre Lopes Machado(NA)]";"Ontologias (inteligência artificial)|Esquemas conceituais|Web semântica|Representação do conhecimento|Computação";"ITA";"doctoralThesis";"openAccess";"2013";"http://www.bd.bibl.ita.br/tde_busca/arquivo.php?codArquivo=2867";"doctoralThesis";"por"
