"id";"title";"authors";"subjectsPOR";"institutions";"types";"accesslevel";"publicationDates";"urls";"formats";"languages";
"ITA_a06a58ba84c79acfff5ff63b1fff1f54";"Aceleração do aprendizado por reforço em sistemas com múltiplos objetivos.";"primary[Helen Cristina de Mattos Senefonte(NA)]";"Aprendizagem (inteligência artificial)|Programação heurística|Agentes de software|Otimização de pareto|Engenharia de software";"ITA";"masterThesis";"openAccess";"2009";"http://www.bd.bibl.ita.br/tde_busca/arquivo.php?codArquivo=892";"masterThesis";"por"
"ITA_662ad1234b1130e10e962db396499373";"Redes neurais artificiais na previsão de deterioração de desempenho de turbinas a gás.";"primary[Gustavo Ravanhani Matuck(NA)]";"Turbinas a gás|Análise de falhas|Desempenho mecânico|Redes neurais|Inteligência artificial|Engenharia mecânica";"ITA";"masterThesis";"openAccess";"2009";"http://www.bd.bibl.ita.br/tde_busca/arquivo.php?codArquivo=912";"masterThesis";"por"
"ITA_b73a700ab44d0d369865c3114e54cbda";"Predição de coeficientes aerodinâmicos de aeronaves de transporte utilizando redes neurais.";"primary[Ricardo Wallach(NA)]";"Coeficientes aerodinâmicos|Identificação de parâmetros|Redes neurais|Aerodinâmica|Inteligência artificial|Projeto de aeronaves|Engenharia aeronáutica";"ITA";"masterThesis";"openAccess";"2007";"http://www.bd.bibl.ita.br/tde_busca/arquivo.php?codArquivo=972";"masterThesis";"por"
"ITA_9af5d06d161d5a8395731a40f79f791d";"Partição espacial utilizando triangulação de Delaunay e Hiperplanos de SVM para classificação de padrões multiclasse";"primary[Luciana Babberg Abiuzi(NA)]";"Classificação de padrões|Máquinas de vetores-suporte|Geração de grades (matemática)|Máquinas aprendizes|Aprendizagem (inteligência artificial)|Matemática computacional|Computação";"ITA";"masterThesis";"openAccess";"2010";"http://www.bd.bibl.ita.br/tde_busca/arquivo.php?codArquivo=1017";"masterThesis";"por"
"ITA_365acfdcecd72033dfa7270880fbd8be";"Trading system aplicado à BOVESPA utilizando redes neurais e computação evolutiva.";"primary[Fernando Henrique Pimentel Araújo(NA)]";"Desenvolvimento de software|Mercado financeiro|Redes neurais|Algoritmos genéticos|Inteligência artificial|Sistemas de apoio à decisão|Capital|Computação";"ITA";"masterThesis";"openAccess";"2010";"http://www.bd.bibl.ita.br/tde_busca/arquivo.php?codArquivo=1016";"masterThesis";"por"
"ITA_9cbbee772979b9f4e468ccb6c8b90adb";"Uso de mapas conceituais como suporte à aquisição autônoma de conhecimento";"primary[Rodrigo Rizzi Starr(NA)]";"Esquemas conceituais|Ontologias (inteligência artificial)|Gestão do conhecimento|Comunicação de idéias|Representação do conhecimento|Ferramentas de desenvolvimento de software|Engenharia de software";"ITA";"masterThesis";"openAccess";"2009";"http://www.bd.bibl.ita.br/tde_busca/arquivo.php?codArquivo=1235";"masterThesis";"por"
"ITA_4d1850985ce0b296ecddbcb465da62bf";"Utilização de expert systems na manutenção de pavimentos.";"primary[Fernando Pugliero Gonçalves(NA)]";"Pavimentos|Sistemas especialistas|Cimento Portland|Asfaltos|Concretos|Inteligência artificial|Engenharia civil|Computação";"ITA";"masterThesis";"openAccess";"1997";"http://www.bd.bibl.ita.br/tde_busca/arquivo.php?codArquivo=1339";"masterThesis";"por"
"ITA_c785b9223073e6484391b2667e6169b6";"Um compensador neural ao controle por torque computado do robô ITA-IEMP.";"primary[Areolino de Almeida Neto(NA)]";"Controle automático|Robôs|Redes neurais|Controladores|Robótica|Inteligência artificial|Computação|Engenharia mecânica";"ITA";"masterThesis";"openAccess";"1998";"http://www.bd.bibl.ita.br/tde_busca/arquivo.php?codArquivo=1410";"masterThesis";"por"
"ITA_d5981c6b4c48341c2a6ed64734bd5366";"Representação de conhecimentos e sistemas especialistas aplicados a sistemas de potência";"primary[Siles Paulino de Toledo(NA)]";"Representação do conhecimento|Sistemas especialistas|Sistemas elétricos de potência|Inteligência artificial|Computação|Engenharia eletrônica";"ITA";"doctoralThesis";"openAccess";"1996";"http://www.bd.bibl.ita.br/tde_busca/arquivo.php?codArquivo=1645";"doctoralThesis";"por"
"ITA_9cc49c2891229a3373c44d121e57450f";"Representação de conhecimento para a interpretação de imagens meteorologicas";"primary[Francisco de Assis Tavares Ferreira Silva(NA)]";"Representação do conhecimento|Radar meteorológico|Radar de abertura real|Imagens|Inteligência artificial|Computação|Engenharia eletrônica";"ITA";"masterThesis";"openAccess";"1993";"http://www.bd.bibl.ita.br/tde_busca/arquivo.php?codArquivo=1749";"masterThesis";"por"
"ITA_a1f075ba383aa2a29a40f3e085b6987f";"Estudo de algoritmos aplicados à análise automática de eletrocardiogramas";"primary[George Azevedo Silva(NA)]";"Reconhecimento de padrões|Eletrocardiografia|Processamento de sinais|Técnicas digitais|Inteligência artificial|Medicina|Engenharia eletrônica";"ITA";"masterThesis";"openAccess";"1991";"http://www.bd.bibl.ita.br/tde_busca/arquivo.php?codArquivo=1811";"masterThesis";"por"
"ITA_707bbfe652133ec6a030fae719911b47";"Coordenação dos atuadores de robôs móveis com pernas usando aprendizado por reforço e múltiplos critérios : simulação e implementação";"primary[Jeeves Lopes dos Santos(NA)]";"Dinâmica de robôs|Locomoção por pernas|Aprendizagem (inteligência artificial)|Teoria de autômatos|Atuadores eletromagnéticos|Robótica|Controle";"ITA";"doctoralThesis";"openAccess";"2011";"http://www.bd.bibl.ita.br/tde_busca/arquivo.php?codArquivo=1897";"doctoralThesis";"por"
"ITA_5dee46de35719a259a0daa99155d0635";"Navegação do robô Trekker usando marcos artificiais e sensores de baixo custo";"primary[Ivo Paixão de Medeiros(NA)]";"Dinâmica de robôs|Navegação|Redução de custos|Sensores|Fusão de multisensor|Inteligência artificial|Robótica|Controle";"ITA";"masterThesis";"openAccess";"2011";"http://www.bd.bibl.ita.br/tde_busca/arquivo.php?codArquivo=1945";"masterThesis";"por"
"ITA_42c6c8fa08cfdef5b9688bd44947471a";"Modelo computacional para valoração e avaliação de redações baseado em lógica Fuzzy";"primary[João Carlos Silva Nobre(NA)]";"Lógica nebulosa|Lingüística|Comunicação escrita|Modelos matemáticos|Matemática computacional|Desenvolvimento de software|Inteligência artificial|Engenharia de software|Computação";"ITA";"doctoralThesis";"openAccess";"2011";"http://www.bd.bibl.ita.br/tde_busca/arquivo.php?codArquivo=1936";"doctoralThesis";"por"
"ITA_2c9ea4018a7c84fca46004feffa818a7";"Projeto e construção de um barco inteligente com integração INS/GPS e bússola";"primary[Douglas Soares dos Santos(NA)]";"Veículos autônomos|Navegação inercial|Fusão de multisensor|Aprendizagem (inteligência artificial)|Sistema de posicionamento global|Barcos|Ancoradouros|Controle";"ITA";"doctoralThesis";"openAccess";"2011";"http://www.bd.bibl.ita.br/tde_busca/arquivo.php?codArquivo=1942";"doctoralThesis";"por"
"ITA_d68ca31842c9ed8fdb603c8e2be546e1";"Casamento de mapas utilizando redes neurais artificiais paraconsistentes";"primary[Anderson Anjos da Silva(NA)]";"Dinâmica de robôs|Redes neurais|Guiamento por casamento de mapas|Reconhecimento de padrões|Inteligência artificial|Robótica|Computação";"ITA";"doctoralThesis";"openAccess";"2011";"http://www.bd.bibl.ita.br/tde_busca/arquivo.php?codArquivo=1929";"doctoralThesis";"por"
"ITA_661498f914a784547ab51952e7563f8b";"Extração do conhecimento contido em ocorrências no transporte coletivo urbano usando árvores de decisão";"primary[Alexandre Bittencourt Faria(NA)]";"Inteligência artificial|Árvores de decisão|Sistemas de computadores embarcados|Mineração de dados|Transporte urbano|Computação";"ITA";"masterThesis";"openAccess";"2011";"http://www.bd.bibl.ita.br/tde_busca/arquivo.php?codArquivo=1957";"masterThesis";"por"
"ITA_10e6854eb220731e37cc0b929daabf44";"Algoritmos para previsão de séries temporais usando raciocínio baseado em casos";"primary[Guilherme Conceição Rocha(NA)]";"Inteligência artificial|Análise de séries temporais|Prognóstico|Raciocínio baseado em modelo|Técnicas de previsão|Computação";"ITA";"doctoralThesis";"openAccess";"2011";"http://www.bd.bibl.ita.br/tde_busca/arquivo.php?codArquivo=1972";"doctoralThesis";"por"
"ITA_6fdb480979d632dc63fb24e758826fe8";"Prognóstico de sistemas aeronáuticos utilizando o algoritmo SVM treinado com dados de voo e registros de manutenção";"primary[Renato de Pádua Moreira(NA)]";"Classificação de padrões|Técnicas de previsão|Máquinas de vetores-suporte|Sistemas aeroespaciais|Prognóstico|Inteligência artificial|Computação";"ITA";"masterThesis";"openAccess";"2012";"http://www.bd.bibl.ita.br/tde_busca/arquivo.php?codArquivo=2059";"masterThesis";"por"
"ITA_d57c10c96f2c761783bc2ac4e664b463";"Modelo de sistema de apoio à decisão por ontologia e rede de Petri colorida";"primary[André Luís Maia Baruffaldi(NA)]";"Sistemas de apoio à decisão|Redes de Petri|Ontologias (inteligência artificial)|Processamento distribuído|Engenharia de software";"ITA";"masterThesis";"openAccess";"2012";"http://www.bd.bibl.ita.br/tde_busca/arquivo.php?codArquivo=2082";"masterThesis";"por"
"ITA_3923fd42df46a5d1a0c427edaab8890a";"Um modelo semântico de busca e recuperação de jogos educacionais para ambientes virtuais de aprendizagem";"primary[Jeane Silva Ferreira Teixeira(NA)]";"Jogos educacionais|Ontologias (inteligência artificial)|Ensino|Aprendizagem|Programas de computadores|Métodos educacionais|Educação|Computação";"ITA";"doctoralThesis";"openAccess";"2012";"http://www.bd.bibl.ita.br/tde_busca/arquivo.php?codArquivo=2105";"doctoralThesis";"por"
"ITA_b65a8304e86c0013286ceb687f35df33";"Rotas de fuga para evacuação de pessoal em caso de acidente em depósitos de explosivos";"primary[Filipe Rodrigues de Souza Moreira(NA)]";"Explosivos|Armazenamento|Explosões|Fragmentação|Simulação|Rotas de fuga|Algoritmos|Inteligência artificial|Computação";"ITA";"masterThesis";"openAccess";"2012";"http://www.bd.bibl.ita.br/tde_busca/arquivo.php?codArquivo=2106";"masterThesis";"por"
"ITA_43576954509e8edbbcf739d75595f0e5";"Uma abordagem para a publicação de dados abertos ligados obtidos a partir de bases de dados relacionais";"primary[Clayton Martins Pereira(NA)]";"Banco de dados|Web semântica|Ontologias (inteligência artificial)|Arquitetura de software|Engenharia de software|Computação";"ITA";"masterThesis";"openAccess";"2012";"http://www.bd.bibl.ita.br/tde_busca/arquivo.php?codArquivo=2180";"masterThesis";"por"
"ITA_7ab8ffb3c0eb09270954d6c2f6ca0122";"An inference model with probabilistic ontologies to support automation in effects-based operations planning";"primary[Henrique Costa Marques(NA)]";"Modelos de decisão|Ontologias (inteligência artificial)|Planejamento de processos automatizados por computador|Sistemas de apoio à decisão|Administração|Engenharia de software|Computação";"ITA";"doctoralThesis";"openAccess";"2012";"http://www.bd.bibl.ita.br/tde_busca/arquivo.php?codArquivo=2190";"doctoralThesis";"eng"
"ITA_90cddf9bf6588166e747c5fa3c038351";"Aplicação de redes neurais artificiais em ciclos de potência com turbinas à gás";"primary[José Antonio Batista Neto(NA)]";"Turbinas a gás|Redes neurais|Inteligência artificial|Ciclos termodinâmicos|Sistemas elétricos de potência|Termodinâmica|Engenharia mecânica";"ITA";"masterThesis";"openAccess";"2009";"http://www.bd.bibl.ita.br/tde_busca/arquivo.php?codArquivo=2228";"masterThesis";"por"
"ITA_fbdfead272883a87c11ae632da00dc7d";"Monitoramento de tráfego aéreo baseado em padrões de trajetórias de aeronaves";"primary[Ronald Annoni Junior(NA)]";"Tráfego aéreo|Análise de trajetórias|Reconhecimento de padrões|Anomalias|Algoritmos|Aprendizagem (inteligência artificial)";"ITA";"doctoralThesis";"openAccess";"2012";"http://www.bd.bibl.ita.br/tde_busca/arquivo.php?codArquivo=2226";"doctoralThesis";"por"
"ITA_0516d8f8096419cb1d6d3f7c3dc1510d";"SLAM em ambientes internos utilizando robô de baixo custo";"primary[Luciano Buonocore(NA)]";"Robôs|Dinâmica de robôs|Redução de custos|Sensores|Fusão de multisensor|Inteligência artificial|Robótica|Controle";"ITA";"doctoralThesis";"openAccess";"2013";"http://www.bd.bibl.ita.br/tde_busca/arquivo.php?codArquivo=2235";"doctoralThesis";"por"
"ITA_718bc06f6609ee893d32554465dcdd13";"COLMEIA - Um analisador de colaborações baseado em metricas aplicaveis a informações semanticamente integradas em um ambiente de GCS";"primary[Gláucia Braga e Silva(NA)]";"Desenvolvimento de software|Administração de projetos|Métricas (software)|Ontologias (inteligência artificial)|Engenharia de software";"ITA";"doctoralThesis";"openAccess";"2013";"http://www.bd.bibl.ita.br/tde_busca/arquivo.php?codArquivo=2249";"doctoralThesis";"por"
"ITA_190e189f9ae2c7765ce61b7401fdccd2";"Método de predição de categorias com formação de conjunto representativo e treinamento competitivo";"primary[Klaifer Garcia(NA)]";"Redes neurais|Reconhecimento de padrões|Técnicas de análise de predição|Inteligência artificial|Telecomunicações|Computação";"ITA";"masterThesis";"openAccess";"2013";"http://www.bd.bibl.ita.br/tde_busca/arquivo.php?codArquivo=2265";"masterThesis";"por"
"ITA_b9bf8dc8b57f4db861b149fb55ba84bd";"Um modelo hierárquico para sistemas especialistas.";"primary[Vera Lúcia da Silva(NA)]";"Sistemas especialistas|Representação do conhecimento|Inteligência artificial|Sistemas distribuídos|Estudo de casos|Computação";"ITA";"masterThesis";"openAccess";"2000";"http://www.bd.bibl.ita.br/tde_busca/arquivo.php?codArquivo=2350";"masterThesis";"por"
"ITA_f96125982e17e2e959782885aeecbd5d";"Intelligent measurement systems based on neural networks.";"primary[Laurizete dos Santos Camargo(NA)]";"Controle automático|Instrumentos de medição|Redes neurais|Inteligência artificial|Polinômios de Chebyshev|Interpolação|Funções de Liapunov|Controle";"ITA";"doctoralThesis";"openAccess";"2000";"http://www.bd.bibl.ita.br/tde_busca/arquivo.php?codArquivo=2355";"doctoralThesis";"eng"
"ITA_8a6b6ea13bf8ac61de7643f7a11883f8";"Intelligent controllers for dynamic systems with state and input constraints and subjected to model uncertainties.";"primary[Leizer Schnitman(NA)]";"Controle adaptativo|Lógica nebulosa|Inteligência artificial|Controle com restrições|Controle automático|Controladores|Sistemas não-lineares|Controle";"ITA";"doctoralThesis";"openAccess";"2001";"http://www.bd.bibl.ita.br/tde_busca/arquivo.php?codArquivo=2452";"doctoralThesis";"eng"
"ITA_41f04def8dacbafea32a96df79ca045b";"Estudo de desempenho de algoritmos de aprendizagem sob condições de ambigüidade sensorial.";"primary[Sildomar Takahashi Monteiro(NA)]";"Redes neurais|Aprendizagem|Algoritmos|Robôs|Avaliação de desempenho|Cinemática|Inteligência artificial|Computação";"ITA";"masterThesis";"openAccess";"2002";"http://www.bd.bibl.ita.br/tde_busca/arquivo.php?codArquivo=2487";"masterThesis";"por"
"ITA_a4b345c354e3763aea585b205277e199";"Redes causais nebulosas.";"primary[Leilton Scandelari Lemos(NA)]";"Sistemas especialistas|Teoria das probabilidades|Inferência estatística|Lógica nebulosa|Inteligência artificial|Controle|Computação";"ITA";"masterThesis";"openAccess";"2002";"http://www.bd.bibl.ita.br/tde_busca/arquivo.php?codArquivo=2482";"masterThesis";"por"
"ITA_06111e67b4db798bd1b9371403a8cd0e";"Estudo sobre redes neurais não supervisionadas aplicado a simulações de interceptação visual de alvos 3D.";"primary[Sidney Antonio Araujo Viana(NA)]";"Controle automático|Redes neurais|Arquitetura (computadores)|Visão por computadores|Controle adaptativo|Simulação computadorizada|Inteligência artificial|Controle";"ITA";"masterThesis";"openAccess";"1999";"http://www.bd.bibl.ita.br/tde_busca/arquivo.php?codArquivo=2648";"masterThesis";"por"
"ITA_d57106062ca5ad1251643aa43ab2087e";"Estudo de um sistema inteligente para o controle de posição do plasma no Tokamak ETE.";"primary[Luis Filipe de Faria Pereira Wiltgen Barbosa(NA)]";"Controle adaptativo|Redes neurais|Dispositivos Tokamak|Fusão controlada|Geração de energia termonuclear|Plasmas (Física)|Inteligência artificial|Controle";"ITA";"doctoralThesis";"openAccess";"2003";"http://www.bd.bibl.ita.br/tde_busca/arquivo.php?codArquivo=2728";"doctoralThesis";"por"
"ITA_720ed8249f3886db93cf175c949b0480";"Uma abordagem para conversão de ontologias de fundamentação em ontologias OWL-DL";"primary[Luís Antonio de Almeida Rodriguez(NA)]";"Ontologias (inteligência artificial)|Ferramentas de desenvolvimento de software|Representação do conhecimento|Recuperação da informação|Engenharia de software|Computação";"ITA";"masterThesis";"openAccess";"2013";"http://www.bd.bibl.ita.br/tde_busca/arquivo.php?codArquivo=2769";"masterThesis";"por"
"ITA_421d7d8283820af150008d7afca7c136";"Modelo e método semântico para organização e recuperação de documentos";"primary[Andréia Dal Ponte Novelli(NA)]";"Arquitetura de software|Web semântica|Ontologias (inteligência artificial)|Tratamento da informação|Recuperação da informação|Documentos eletrônicos|Engenharia de software|Computação";"ITA";"doctoralThesis";"openAccess";"2013";"http://www.bd.bibl.ita.br/tde_busca/arquivo.php?codArquivo=2873";"doctoralThesis";"por"
"ITA_052335e5f139450925183e9d3fd09fc4";"Uma abordagem de engenharia reversa para extração do projeto de sistemas de software crítico embarcado";"primary[Rovedy Aparecida Busquim e Silva(NA)]";"Sistemas de computadores embarcados|Verificação formal|Confiabilidade de software|Verificação de programa (computadores)|Ontologias (inteligência artificial)|Engenharia de software";"ITA";"doctoralThesis";"openAccess";"2013";"http://www.bd.bibl.ita.br/tde_busca/arquivo.php?codArquivo=2863";"doctoralThesis";"por"
"ITA_016bbd5ccdd97a8fa490a7832d5fdb50";"MIDC - um método de inferência difusa para classificação em banco de dados";"primary[Strauss Cunha Carvalho(NA)]";"Banco de dados|Inferência estatística|Inteligência artificial|Sistemas de informação|Recuperação da informação|Computação";"ITA";"masterThesis";"openAccess";"2014";"http://www.bd.bibl.ita.br/tde_busca/arquivo.php?codArquivo=2963";"masterThesis";"por"
"ITA_8babd75d78d96c14f1166eebe3fd15a5";"ERG-ARCH : a reinforcement learning architecture for propositionally constrained multi-agent state spaces";"primary[Anderson Viçoso de Araújo(NA)]";"Aprendizagem (inteligência artificial)|Sistemas tutores inteligentes|Processos de Markov|Avaliação de desempenho de software|Computação";"ITA";"doctoralThesis";"openAccess";"2014";"http://www.bd.bibl.ita.br/tde_busca/arquivo.php?codArquivo=3096";"doctoralThesis";"eng"
"ITA_3201277b2cc0fde07379503593369ab1";"Abordagem para verificação de sistemas de controle para automação flexível";"primary[Guilherme Kisseloff Coracini(NA)]";"Projeto auxiliado por computador|Robótica|Manufatura auxiliada por computador|Inteligência artificial|Automação|Controle|Computação";"ITA";"masterThesis";"openAccess";"2014";"http://www.bd.bibl.ita.br/tde_busca/arquivo.php?codArquivo=3133";"masterThesis";"por"
"ITA_aa83c4d058cced756a9d4ca7874d0faf";"Um método baseado em ontologias para interpretação e catalogação de elementos pouco evidentes em imagens";"primary[Tiago Josué Diedrich(NA)]";"Catalogação|Ontologias (inteligência artificial)|Imagens|Processamento de imagens|Normalização|Sistemas de informação|Biblioteconomia|Computação";"ITA";"masterThesis";"openAccess";"2014";"http://www.bd.bibl.ita.br/tde_busca/arquivo.php?codArquivo=3136";"masterThesis";"por"
"ITA_5fc70a545c8ce9fa815c63fd5f7b2561";"Modelo de agente inteligente para otimização de planejamento em linhas de produção de software";"primary[Denis Ávila Montini(NA)]";"Inteligência artificial|Engenharia de software|Controle de produção|Otimização|Planejamento|Engenharia de produção|Computação";"ITA";"doctoralThesis";"openAccess";"2014";"http://www.bd.bibl.ita.br/tde_busca/arquivo.php?codArquivo=3129";"doctoralThesis";"por"
"ITA_e2f2c13b43cd835d38777b3154a99ca6";"An attentional model for intelligent robotics agents";"primary[Esther Luna Colombini(NA)]";"Controle automático|Inteligência artificial|Robótica|Controle adaptativo|Robôs|Arquitetura (computadores)|Controle|Computação";"ITA";"doctoralThesis";"openAccess";"2014";"http://www.bd.bibl.ita.br/tde_busca/arquivo.php?codArquivo=3201";"doctoralThesis";"eng"
"ITA_40fd689613402739787aa1bce1c15c05";"Uma infraestrutura baseada em tecnologias da web semântica para o controle de versão de software";"primary[Juliano de Almeida Monte-Mor(NA)]";"Ontologias (inteligência artificial)|Tecnologia da informação|Desenvolvimento de software|Web semântica|Engenharia de software";"ITA";"doctoralThesis";"openAccess";"2014";"http://www.bd.bibl.ita.br/tde_busca/arquivo.php?codArquivo=3187";"doctoralThesis";"por"
"ITA_34a329391422b5efe95bbcab3781c241";"Aplicação de métodos computacionais inteligentes à física atômica e molecular";"primary[Kallaran Cavalcante Barros(NA)]";"Aminoácidos|Mapas auto-organizáveis (redes neurais)|Inteligência artificial|Físico-Química|Física molecular|Física";"ITA";"masterThesis";"openAccess";"2015";"http://www.bd.bibl.ita.br/tde_busca/arquivo.php?codArquivo=3209";"masterThesis";"por"
"ITA_50ddf83eb127970e63b7448d24a34338";"Representação semântica de trajetórias para detecção de anomalias marítimas";"primary[Paulo Augusto Neves de Carvalho Elias(NA)]";"Detecção|Anomalias|Ambientes marinhos|Embarcações|Simulação computadorizada|Ontologias (inteligência artificial)|Web semântica|Engenharia de software";"ITA";"masterThesis";"openAccess";"2014";"http://www.bd.bibl.ita.br/tde_busca/arquivo.php?codArquivo=3186";"masterThesis";"por"
"ITA_e8e0fe113d93a7595d298e1db5d41139";"Omnidirectional ZMP-based walking for a humanoid robot";"primary[Marcos Ricardo Omena de Albuquerque Maximo(NA)]";"Robôs humanóides|Dinâmica de robôs|Controle de robôs|Locomoção por pernas|Inteligência artificial|Robótica|Controle";"ITA";"masterThesis";"openAccess";"2015";"http://www.bd.bibl.ita.br/tde_busca/arquivo.php?codArquivo=3242";"masterThesis";"eng"
"ITA_944448f2ad24223c308b860f24c06844";"Modelos de regressão para análise de demanda de formação de mão de obra qualificada da indústria local";"primary[Marcus Vinicius Begossi(NA)]";"Aprendizagem (inteligência artificial)|Redes neurais|Análise de regressão|Mão de obra|Educação industrial|Ensino|Computação";"ITA";"masterThesis";"openAccess";"2015";"http://www.bd.bibl.ita.br/tde_busca/arquivo.php?codArquivo=3333";"masterThesis";"por"
"ITA_53c3763614a90db5c9c900603be9ff01";"Controladores automáticos inteligentes com aplicações em isolamento de vibrações mecânicas.";"primary[Fábio Meneghetti Ugulino de Araújo(NA)]";"Controle automático|Vibração|Controle robusto|Controladores|Lógica nebulosa|Inteligência artificial|Simulação computadorizada|Mecânica (Física)|Controle";"ITA";"doctoralThesis";"openAccess";"2002";"http://www.bd.bibl.ita.br/tde_busca/arquivo.php?codArquivo=2565";"doctoralThesis";"por"
"ITA_61d99596a7955d4944b87125b4c758fd";"Contribuições à síntese automática de processadores para lógica nebulosa.";"primary[Roberto D'Amore(NA)]";"Controladores nebulosos|Lógica nebulosa|VHDL (linguagem de programação)|Sistemas digitais|Inteligência artificial|Controle";"ITA";"doctoralThesis";"openAccess";"1998";"http://www.bd.bibl.ita.br/tde_busca/arquivo.php?codArquivo=2618";"doctoralThesis";"por"
"ITA_75efd74b9abaae2492c35999e3dda74f";"Um sistema especialista para a gerência pró-ativa de redes de computadores.";"primary[Cecília de Azevedo Castro Cesar(NA)]";"Sistemas especialistas|Inteligência artificial|Redes de computadores|Sistemas de administração|Protocolos de comunicação|Sistemas operacionais (computadores)|Interfaces|Computação";"ITA";"masterThesis";"openAccess";"1998";"http://www.bd.bibl.ita.br/tde_busca/arquivo.php?codArquivo=2623";"masterThesis";"por"
"ITA_9f3e9e8d322ccb87be86f9880b1c8da4";"Uma abordagem tabular para o desenvolvimento de agentes inteligentes reativos.";"primary[Antônio Maria Pereira de Resende(NA)]";"Sistemas especialistas|Conhecimento|Inteligência artificial|JAVA (linguagem de programação)|Estudo de casos|Computação";"ITA";"masterThesis";"openAccess";"1999";"http://www.bd.bibl.ita.br/tde_busca/arquivo.php?codArquivo=2665";"masterThesis";"por"
"UFES_172f72f6e9da99745e0ab6889e54626a";"Filtro de partículas hibridizado com métodos da computação natural para detecção e rastreamento";"primary[Lima, Leandro Muniz de(NA)]";"Rastreamento automático|Processamento de imagens|Inteligência artificial|Processo estocástico|Otimização matemática";"UFES";"masterThesis";"openAccess";"2011";"http://repositorio.ufes.br/handle/10/6412";"masterThesis";"por"
"UFES_2a756e4594ccf7acb7494ad9f1709481";"iMap : um mecanismo de inferência para mapas conceituais";"primary[Perin, Wagner de Andrade(NA)]";"";"UFES";"masterThesis";"openAccess";"2014";"http://repositorio.ufes.br/handle/10/1484";"masterThesis";"por"
"UFV_6ae7b4d9727eb7d0c4cc41460fb90892";"Computação humana Aplicada à geração de conteúdo em jogos de plataforma 2D";"primary[Reis, Willian Magno Pereira(NA)]";"";"UFV";"masterThesis";"openAccess";"2015";"http://www.locus.ufv.br/handle/123456789/7584";"masterThesis";"por"
"UFV_4cb8c9754e4aae5367469bcdc2e1c87a";"Modelagem da vazão em cursos de água com base em modelos conceituais chuva-vazão e em método de inteligência artificial";"primary[Uliana, Eduardo Morgan(NA)]";"";"UFV";"doctoralThesis";"openAccess";"2016";"http://www.locus.ufv.br/handle/123456789/10997";"doctoralThesis";"por"
"UFV_6aec896c567a312af49eb3ab3c1fa3f8";"Aprendizado profundo aplicado à quantificação da severidade de sintomas de doenças e pragas foliares";"primary[Gonçalves, Juliano de Paula(NA)]";"";"UFV";"masterThesis";"openAccess";"2020";"https://locus.ufv.br//handle/123456789/28373";"masterThesis";"por"
