"id";"title";"authors";"subjectsPOR";"institutions";"types";"accesslevel";"publicationDates";"urls";"formats";"languages";
"URGS_75c2fcda903aa377da3389dd64cf3c1d";"Estratégia de elaboração de projetos de engenharia em sistema tutor inteligente";"primary[Ferreira Filho, Raymundo Carlos Machado(NA)]";"Engenharia|Ensino|Inteligência artificial|Informática na educação";"UFRGS";"doctoralThesis";"openAccess";"2008";"http://hdl.handle.net/10183/21366";"doctoralThesis";"por"
"URGS_54a98e45223f9e41faaf87395ed210c0";"Aplicações de técnicas de inteligência artificial à comunicação alternativa e aumentativa";"primary[Silveira, Milene Selbach(NA)]";"Informática : Educação|Inteligência artificial|Comunicacao alternativa : Aumentativa|Educação especial|Informatica : Deficientes auditivos";"UFRGS";"masterThesis";"openAccess";"1996";"http://hdl.handle.net/10183/23953";"masterThesis";"por"
"URGS_ee25e074e09e07bbed03f0d47272ef91";"Um estudo sobre objetos com comportamento inteligente";"primary[Amaral, Janete Pereira do(NA)]";"Engenharia : Software|Orientacao : Objetos|Inteligência artificial|Representacao : Conhecimento|Ambiente : Programacao|Desenvolvimento : Software";"UFRGS";"masterThesis";"openAccess";"1993";"http://hdl.handle.net/10183/25458";"masterThesis";"por"
"URGS_81c947fe26ed85e7a4f91ff9a0836079";"Um modelo para sistemas especialistas conexionistas híbridos";"primary[Reategui, Eliseo Berni(NA)]";"Inteligência artificial|Sistemas especialistas|Aprendizagem : Maquina|Redes neurais|Informática médica";"UFRGS";"masterThesis";"openAccess";"1993";"http://hdl.handle.net/10183/25522";"masterThesis";"por"
"URGS_0f5c2f3f2cf5cd4ea9ead70f1adf2b74";"Sistema de solução de problemas cooperativos : um estudo de caso";"primary[Flores, Cecilia Dias(NA)]";"Inteligencia artificial distribuida|Sistemas especialistas|Aquisicao : Conhecimento|Informática médica";"UFRGS";"masterThesis";"openAccess";"1995";"http://hdl.handle.net/10183/25624";"masterThesis";"por"
"URGS_c54e8a0b5c9000c7963719fafb137b99";"Using an animated pedagogical agent to interact affectively with the student";"primary[Jaques, Patricia Augustin(NA)]";"Computação afetiva|Relações homem-máquina|Inteligência artificial : Educação|Informática : Educação";"UFRGS";"doctoralThesis";"openAccess";"2004";"http://hdl.handle.net/10183/5886";"doctoralThesis";"eng"
"UFSM_66ec5a56363445a6153c3e0a15e58168";"Identificação de áreas de clareira na floresta amazônica por meio de dados lidar, imagens de média resolução espacial e inteligência artificial";"primary[Oliveira, Bruna Andriéli Simões de(http://lattes.cnpq.br/4737002366422187)]";"Clareiras no dossel florestal|Amazônia|Inteligência artificial|Sensoriamento remoto";"UFSM";"masterThesis";"openAccess";"2020";"http://repositorio.ufsm.br/handle/1/23365";"masterThesis";"por"
"UFPB_1fc79661ef100ef970401c15ea91482a";"Controle neuro-fuzzy para eficiência energética de sistemas de abastecimento de água com demanda variável";"primary[Moreira, Hugo Augusto Marinho(NA)]";"Eficiência energética|Identificação de sistemas|Automação|Inteligência artificial|Sistemas hidráulicos|Energy efficiency|Systems identification|Automation|Artificial intelligence|Hydraulic system|CNPQ::ENGENHARIAS::ENGENHARIA MECANICA";"UFPB";"masterThesis";"openAccess";"2020";"https://repositorio.ufpb.br/jspui/handle/123456789/18509";"masterThesis";"por"
"UFPB_a9a72d85d6f23b59b9d3e18856283504";"O impacto do uso das tecnologias disruptivas da sociedade Informacional nas relações de trabalho: conformação da regulação normativa sobre inteligência artificial ao valor social do trabalho";"primary[Carvalho, Marina Morais de(NA)]";"Tecnologias disruptivas|Inteligência artificial|Desemprego tecnológico|Valor social do trabalho|Direitos humanos|Disruptive technologies|Artificial Intelligence|Technological unemployment|Social value of work|Human rights|CNPQ::CIENCIAS SOCIAIS APLICADAS::DIREITO";"UFPB";"masterThesis";"openAccess";"2021";"https://repositorio.ufpb.br/jspui/handle/123456789/21280";"masterThesis";"por"
"UFPB_483998c364f252dca710b18184e22510";"Uso de predição de defeitos aplicada ao processo de identificação e recomendação para priorização de bugs";"primary[Pontes, Alan Bonifácio de(NA)]";"Predição de defeitos de software|Testes de software|Inteligência artificial|Engenharia de software|Software defect prediction|Software testing|Artificial intelligence|Software engineering|CNPQ::CIENCIAS EXATAS E DA TERRA::CIENCIA DA COMPUTACAO";"UFPB";"masterThesis";"openAccess";"2017";"https://repositorio.ufpb.br/jspui/handle/123456789/12907";"masterThesis";"por"
"UNIOESTE-1_709d9ec26e9988245b510a3e16919cdc";"Redes neurais artificiais BIGRU_CNN aplicadas à previsão de demanda de energia elétrica de curto prazo";"primary[Soares, Lucas Duarte(http://lattes.cnpq.br/4034781064552418)]";"Inteligência artificial|Aprendizado de máquinha|Redes neurais recorrentes|Séries temporais";"UNIOESTE";"masterThesis";"openAccess";"2021";"http://tede.unioeste.br/handle/tede/5712";"masterThesis";"por"
"UFPB_24edc0f58f0d8e9b91d4a0af46958438";"Sistemas Inteligentes na Educação.";"primary[Dias., Daniele dos Santos Ferreira(NA)]";"Informática na Educação|Sociedade do Conhecimento|Sistemas Inteligentes|Ciberespaço|Inteligência Artificial|Computer science in Education|Society of Knowledge|Intelligent Systems|Cyberspace|Artificial Intelligence|CNPQ::CIENCIAS HUMANAS::EDUCACAO";"UFPB";"masterThesis";"openAccess";"2009";"https://repositorio.ufpb.br/jspui/handle/tede/4869";"masterThesis";"por"
"UFPB_a79d1fc5a662bf940e6e773c048d3af0";"Aprendizado por esforço aplicado ao combate em jogos eletrônicos de estratégia em tempo real";"primary[Botelho Neto, Gutenberg Pessoa(NA)]";"Inteligência artificial|Aprendizagem de máquina|State Action Reward State Action - SARSA|Artificial intelligence|Real Time Strategy - RTS|Machine learning|CIENCIAS EXATAS E DA TERRA::CIENCIA DA COMPUTACAO";"UFPB";"masterThesis";"openAccess";"2014";"https://repositorio.ufpb.br/jspui/handle/tede/6128";"masterThesis";"por"
"USIN_398c52e463ca4874810894b7adad7f95";"Utilização de algoritmos genéticos em restauração de sistemas de potência";"primary[Mendel, Carlos Alberto(NA)]";"algoritmos genteticos|inteligência artificial|restauração|sistemas de potência";"UNISINOS";"masterThesis";"openAccess";"2006";"http://www.repositorio.jesuita.org.br/handle/UNISINOS/2217";"masterThesis";"por"
"USIN_c7c695a02293eb504230f47fc146c354";"Exploring text classification methods in oncological medical notes using machine learning and deep learning";"primary[Schwertner, Marco Antonio(NA)]";"Inteligência artificial|Aprendizagem profunda|Aprendizagem de máquina|Saúde|Oncologia";"UNISINOS";"masterThesis";"openAccess";"2020";"http://www.repositorio.jesuita.org.br/handle/UNISINOS/9461";"masterThesis";"eng"
"USIN_61612059700b99a946cc454064fd40db";"Detecção e classificação da alta expressão da proteína e-caderina no carcinoma da mama através de uma rede neural artificial";"primary[Teixeira, Fabiano Godois(NA)]";"Mamas-Câncer|Inteligência artificial|Inovações disruptivas|Redes neurais (computação)";"UNISINOS";"masterThesis";"openAccess";"2020";"http://www.repositorio.jesuita.org.br/handle/UNISINOS/9679";"masterThesis";"por"
"USIN_6b67966028d21b2523973977ae539cc3";"Inteligência artificial no Supremo Tribunal Federal e os reflexos sobre as matérias tributárias";"primary[Silva, Vinicius Ferrasso da(NA)]";"Repercussão geral|Discricionariedade|Viese cognitivo|Viese algorítmico|Fundamentação jurídica|Inteligência artificial";"UNISINOS";"doctoralThesis";"openAccess";"2020";"http://www.repositorio.jesuita.org.br/handle/UNISINOS/9785";"doctoralThesis";"por"
"USIN_944c6dd48bf6872f391c5f3da0e18438";"A Quarta Revolução Industrial e o papel dos sindicatos";"primary[Fernandes, Paulo Roberto(NA)]";"Desemprego tecnológico|Tecnologias emergentes|Automação|Quarta revolução industrial|Inteligência artificial";"UNISINOS";"masterThesis";"openAccess";"2021";"http://www.repositorio.jesuita.org.br/handle/UNISINOS/9823";"masterThesis";"por"
"USIN_a1a06c0f67e33b3e182350b95d74c271";"Inteligência artificial no Tribunal de Justiça do Rio Grande do Sul: desafios e possibilidades no atual estado da arte";"primary[Arceno, Taynara Silva(NA)]";"Inteligência artificial|Decisão judicial|Tribunal de Justiça do RS|Princípios constitucionais";"UNISINOS";"masterThesis";"openAccess";"2021";"http://www.repositorio.jesuita.org.br/handle/UNISINOS/9861";"masterThesis";"por"
"USIN_e3701ebc5cefdb8a67444c589a7cd724";"Investigação de diferentes métodos e recursos para controle de prótese de mão através da classificação de sinais EMG via aprendizado de máquina";"primary[Souza, João Olegário de Oliveira de(NA)]";"Aprendizado de máquina|Prótese de mão|Eletromiografia|Inteligência artificial|Reconhecimento de padrões";"UNISINOS";"doctoralThesis";"openAccess";"2021";"http://www.repositorio.jesuita.org.br/handle/UNISINOS/10571";"doctoralThesis";"por"
"USIN_d6715de6bffe72d020a513f3d89ee68e";"Metaheurísticas aplicadas na sintonia de controladores PID: estudo de casos";"primary[Souza, João Olegário de Oliveira de(NA)]";"Controladores PID|Algoritmos genéticos|Otimização|Inteligência artificial";"UNISINOS";"masterThesis";"openAccess";"2013";"http://www.repositorio.jesuita.org.br/handle/UNISINOS/4457";"masterThesis";"por"
"USIN_28e48454f3870e25aaee2c3b43cff404";"Computadores e mentes: uma analogia filosófica";"primary[Lima, Welton Dias de(NA)]";"O jogo da Imitação|Máquina de Turing|Objeções Filosóficas à IA|Aprendizado de máquina|Inteligência artificial";"UNISINOS";"masterThesis";"openAccess";"2017";"http://www.repositorio.jesuita.org.br/handle/UNISINOS/6692";"masterThesis";"por"
"USIN_57fd57b3847b64cf3008c88896b71d2f";"Avaliação da integração de abordagens de verificação de fake news";"primary[Camargo, Jonathan Pereira(NA)]";"Verificação de fake news|Classificação de texto|Inteligência artificial";"UNISINOS";"masterThesis";"openAccess";"2022";"http://www.repositorio.jesuita.org.br/handle/UNISINOS/11775";"masterThesis";"por"
"USIN_7124166fe3e2576788d0ccb6e1968511";"ATHENA I: an architecture for real-time monitoring of physiological signals supported by artificial intelligence";"primary[Fröhlich, William da Rosa(NA)]";"Aquisição multisinais|Detecção de estresse|Inteligência artificial|Sensores vestíveis|Sinais fisiológicos";"UNISINOS";"masterThesis";"openAccess";"2022";"http://www.repositorio.jesuita.org.br/handle/UNISINOS/11778";"masterThesis";"por"
"USIN_48206713d840e8aca728b09761fef2ec";"Inteligência artificial centrada no ser humano e sua aplicação no poder judiciário brasileiro: o exemplo do projeto do TRT da 4ª Região";"primary[Machado, Fernanda de Vargas(NA)]";"Inteligência artificial|Poder judiciário|Vantagens|Riscos|Centralidade no ser humano|Confiança|Transparência";"UNISINOS";"masterThesis";"openAccess";"2022";"http://www.repositorio.jesuita.org.br/handle/UNISINOS/12026";"masterThesis";"por"
"UEPG_18a9340b9e1233699707417f5b4da5e3";"SISTEMA DE NAVEGAÇÃO POR GEORREFERENCIAMENTO COM CORREÇÃO DE ROTA POR LÓGICA FUZZY APLICADO À ROBÓTICA AGRÍCOLA'";"primary[Rosa, Anderson Estevam da(http://buscatextual.cnpq.br/buscatextual/visualizacv.do?id=K4559082T0)]";"lógica Fuzzy|inteligência artificial|sistema computacional|sistema embarcado|georreferenciamento";"UEPG";"masterThesis";"openAccess";"2012";"http://tede2.uepg.br/jspui/handle/prefix/153";"masterThesis";"por"
"UFG_ccd572367089fc4230d5b27c327fd051";"Rastreador web não supervisionado para aquisição, enriquecimento e predição de dados de usuários de redes sociais por intermédio de métodos de inteligência computacional";"primary[Vieira Sobrinho, José Luís(NA)]";"Inteligência computacional|Rede neural artificial|Rede social|Rastreador|Perceptron de múltiplas camadas|Crawler|Soft computing|Artificial neural network|Social network|Multilayer perceptron|ENGENHARIAS::ENGENHARIA ELETRICA";"UFG";"masterThesis";"openAccess";"2019";"http://repositorio.bc.ufg.br/tede/handle/tede/9722";"masterThesis";"por"
"UFG_88175a08677c1105421d7b76878b8e58";"Previsão do lead time de processos usando mineração de dados";"primary[Oliveira, Maíza Biazon de(NA)]";"Mineração de dados|Inteligência artificial|Aprendizado de máquina|Lead time|Data mining|Artificial intelligence|Knowledge discovery in databases|Machine learning|ENGENHARIAS::ENGENHARIA DE PRODUCAO::ENGENHARIA DO PRODUTO";"UFG";"masterThesis";"openAccess";"2021";"http://repositorio.bc.ufg.br/tede/handle/tede/11340";"masterThesis";"por"
"UFG_b9a36586ed17a3ed29fcacc486ed3838";"Aplicação da inteligência artificial, ontologia e mineração de dados para classificação de sentenças judiciais";"primary[Castro Junior, Antonio Pires de(NA)]";"Inteligência artificial|Aprendizado por similaridade|Classificação de texto|Aprendizado de máquina|Gestão do conhecimento|Artificial intelligence|Similarity-learning|Text classification|Machine learning|Knowledge management|CIENCIAS EXATAS E DA TERRA::CIENCIA DA COMPUTACAO::SISTEMAS DE COMPUTACAO";"UFG";"doctoralThesis";"openAccess";"2021";"http://repositorio.bc.ufg.br/tede/handle/tede/12005";"doctoralThesis";"por"
"UFG_75761e211b9ac673252fe4c223179025";"Inteligência artificial na análise de patologias corruptivas: delimitação jurisprudencial nas decisões do TCU do conceito aberto de cláusula restritiva ao caráter competitivo em editais de licitação";"primary[Silva, Sérvio Túlio Teixeira e(NA)]";"Jurisprudência|Precedentes administrativos|Inteligência Artificial|Licitação pública|Cláusulas restritivas ao caráter competitivo|Jurisprudence|Administrative precedents|Artificial Intelligence|Public bidding|Competitiveness restrictive clauses|CIENCIAS SOCIAIS APLICADAS::DIREITO";"UFG";"masterThesis";"openAccess";"2020";"http://repositorio.bc.ufg.br/tede/handle/tede/11119";"masterThesis";"por"
"UFG_d5c0af81fe834cae66db55b4a2f79ed7";"Um sistema WebGIS para classificação supervisionada de cobertura do solo utilizando inteligência artificial";"primary[Fernandes, Yuri Kuivjogi(NA)]";"Sensoriamento remoto|Identificação espectral|Inteligência artificial|Processamento em nuvem|Culturas agrícolas|Remote sensing|Spectral identification|Artificial intelligence|Cloud processing|Agricultural crops|CIENCIAS EXATAS E DA TERRA::CIENCIA DA COMPUTACAO";"UFG";"masterThesis";"openAccess";"2022";"http://repositorio.bc.ufg.br/tede/handle/tede/12519";"masterThesis";"por"
"METO_edfc0ee1d54839c2b5477b8e783ec6ce";"NOTÍCIAS AUTOMATIZADAS A evolução que levou o jornalismo a ser feito por não humanos";"primary[CARREIRA, KRISHMA ANAÍSA COURA(NA)]";"Notícia automatizada; Jornalismo automatizado; Inteligência Artificial e Jornalismo; Algoritmos jornalísticos; Narrativa automatizada";"METODISTA";"masterThesis";"openAccess";"2017";"http://tede.metodista.br/jspui/handle/tede/1671";"masterThesis";"por"
"UPM_15b05330c4161151cfd1d5e479cac76e";"Sistema especialista para auxílio na utilização de jogos não-educacionais no processo de aprendizagem";"primary[Resende, Robson de Souza(http://lattes.cnpq.br/4524401626429689)]";"jogos digitais|educação|jogos digitais educacionais|sistema especialista|inteligência artificial";"MACKENZIE";"masterThesis";"openAccess";"2015";"http://dspace.mackenzie.br/handle/10899/24369";"masterThesis";"por"
"UFCG_d7fe15cd7aeb9f2271efb8dcef2a6536";"Abordagem para redução de complexidade de RNA usando reconfiguração dinâmica.";"primary[BRUNELLI, Luiz.(http://lattes.cnpq.br/8019874133102405)]";"Rede neural|Inteligência artificial.|Neurociência computacional|Computação reconfigurável|VLSI|FPGA|Reconfiguração dinâmica|Artificial Neural Networks|Dynamic reconfiguration|Chaveamento dinâmico de circuitos";"UFCG";"doctoralThesis";"openAccess";"2005";"http://dspace.sti.ufcg.edu.br:8080/jspui/handle/riufcg/1435";"doctoralThesis";"por"
"UFCG_d46ab7e63b72860976c2cff22508812b";"Abordagem avaliativa multidimensional para previsão da evasão do discente em cursos on-line.";"primary[MORAIS, Alana Marques de.(http://lattes.cnpq.br/2552086192905349)]";"Inteligência Artificial|Avaliação Multidimensional|Educação à Distância - Evasão|Mineração de Texto|Lógica Fuzzy|FuzzySD|Artificial Intelligence|Fuzzy System|Student Multidimensional Assessment|Distance Learning - Dropout|Online Courses";"UFCG";"doctoralThesis";"openAccess";"2018";"http://dspace.sti.ufcg.edu.br:8080/jspui/handle/riufcg/1711";"doctoralThesis";"por"
"UFCG_306d12461a6e4d79bab4d96f21027613";"Sobre a questão da formalização do raciocínio abdutivo via sistemas dedutivos rotulados.";"primary[RICCIO, Nicia Cristina Rocha.(http://lattes.cnpq.br/2232437340737784)]";"Inteligência Artificial|Raciocínio Não-monotônico|Lógica Matemática|Sistema Dedutivo Rotulado|Teoria de Aprendizado Abdutivo|Artificial intelligence|Non-monotonic Reasoning|Mathematical Logic|Labeled Deductive System|Abductive Learning Theory";"UFCG";"masterThesis";"openAccess";"1995";"http://dspace.sti.ufcg.edu.br:8080/jspui/handle/riufcg/10153";"masterThesis";"por"
"UFCG_32e35911605c538af15600b086668b12";"Modelagem do sistema de proteção e controle de uma usina hidroelétrica para diagnóstico de falta.";"primary[CAETANO, Marcos Antônio dos Santos.(http://lattes.cnpq.br/5656028750243919)]";"Usina Hidroelétrica|Redes de Petri|Sistema de Diagnóstico de Falta|Recomposição do Sistema de Geração|Inteligência Artificial|Hydroelectric Plant|Petri Nets|Fault Diagnosis System|Generation System Recomposition|Artificial Intelligence";"UFCG";"masterThesis";"openAccess";"2014";"http://dspace.sti.ufcg.edu.br:8080/jspui/handle/riufcg/10947";"masterThesis";"por"
"UFCG_7f9c889c353be83f192b2ac314a19eff";"A utilização de inteligências artificiais cognitivas na agroindústria e seus impactos em perspectiva do direito brasileiro atual.";"primary[BATISTA, Lucas de Oliveira.(http://lattes.cnpq.br/9567342030168071)]";"Gestão agroindustrial|Agroindustrial management|Tecnologia de ponta|Cutting-edge technology|Inteligência artificial|Artificial intelligence|Computação cognitiva|Cognitive computing|Internet das coisas|Internet of Things";"UFCG";"masterThesis";"openAccess";"2019";"http://dspace.sti.ufcg.edu.br:8080/jspui/handle/riufcg/11442";"masterThesis";"por"
"UFCG_521f3f94e6d8782e9db01c965dcefe8f";"SAVAD: sistema de avaliação de desempenho de modelos de redes de filas.";"primary[SOUTO, Francisco de Assis Coutinho.(http://lattes.cnpq.br/4515679451261695)]";"Inteligência Artificial|Rede de Computadores|Redes de Filas|SAVAD|Abordagem Orientada a Objetos|Linguagem de Programação C++|Artificial Intelligence|Computer Network|Queue Networks|Object Oriented Approach|C ++ Programming Language";"UFCG";"masterThesis";"openAccess";"1993";"http://dspace.sti.ufcg.edu.br:8080/jspui/handle/riufcg/11517";"masterThesis";"por"
"UFCG_bbee93a1dab6f0d76f55c9bcf4b3c189";"Um ambiente para o agente pedagógico de aprendizagem colaborativa em harmonização ecológica - APACHE.";"primary[REIS, Ângela Batista.(http://lattes.cnpq.br/4811941175823833)]";"Informática na Educação|Inteligência Artificial Distribuída|Aprendizagem Colaborativa|Agentes Pedagógicos|Computer Science in Education|Distributed Artificial Intelligence|Collaborative Learning|Teaching Agents";"UFCG";"masterThesis";"openAccess";"2001";"http://dspace.sti.ufcg.edu.br:8080/jspui/handle/riufcg/3950";"masterThesis";"por"
"UFCG_37023fd9e2a0d41a72e7dd13327be06f";"Uma abordagem híbrida de aquisição de conhecimento empregando RBC e aprendizagem indutiva: aplicação ao domínio de help desk.";"primary[COÊLHO, Álvaro Vinícius de Souza.(http://lattes.cnpq.br/0191048428072248)]";"Inteligência Artificial|Raciocínio Baseado em Casos|Data Mining|Help Desk|Banco de Dados|Artificial Intelligence|Case Based Reasoning|Database";"UFCG";"masterThesis";"openAccess";"2000";"http://dspace.sti.ufcg.edu.br:8080/jspui/handle/riufcg/3952";"masterThesis";"por"
"UFCG_55c4566850a136906f5c6cf042eab84a";"TUTA – um tutor baseado em agentes no contexto do ensino a distância.";"primary[SILVA, Aleksandra do Socorro da.(http://lattes.cnpq.br/9825582909788318)]";"Inteligência Artificial|Sistemas Tutores Inteligentes|Educação a Distância|Metodologia Orientada a Agentes|Metodologia Orientada a Objetos|Artificial Intelligence|Smart Tutors|Distance Education|Agent-Oriented Methodology|Object Oriented Methodology";"UFCG";"masterThesis";"openAccess";"2000";"http://dspace.sti.ufcg.edu.br:8080/jspui/handle/riufcg/3954";"masterThesis";"por"
"UFCG_d441f261b9cb287069b4484a4b09f7b4";"Uma abordagem baseada em regras para detecção automática de eventos pré-definidos em vídeos.";"primary[ALMEIDA, Francisco Fabian de Macedo.(http://lattes.cnpq.br/8567545066790732)]";"Inteligência Artificial|Sistemas Baseados em Regras|Visão Computacional|Vigilância Automática|Eventos em Vídeo|Artificial Intelligence|Rules Based Systems|Computer Vision|Automatic Surveillance|Video Events";"UFCG";"masterThesis";"openAccess";"2010";"http://dspace.sti.ufcg.edu.br:8080/jspui/handle/riufcg/4594";"masterThesis";"por"
"UFCG_40275f822b7e2b044e2800f3fbb4517f";"Um modelo computacional para a construção de sistemas educacionais adaptativos e semânticos.";"primary[PINTO, Ig Ibert Bittencourt Santana.(http://lattes.cnpq.br/4038730280834132)]";"Inteligência Artificial – Sistemas Multiagentes|Web Semântica|Educação à Distância|Ambientes Educacionais – Web Semântica|Artificial Intelligence - Multiagent Systems|Semantic Web|Distance Education|Educational Environments - Semantic Web";"UFCG";"doctoralThesis";"openAccess";"2009";"http://dspace.sti.ufcg.edu.br:8080/jspui/handle/riufcg/4598";"doctoralThesis";"por"
"UFCG_c607e02f8a5da4ff9e7f4891d8d87699";"Um modelo genérico de agente racional baseado em raciocínio assíncrono interativo.";"primary[MARTINS, Lidiana de França.(http://lattes.cnpq.br/2408830707025912)]";"Inteligência Artificial|Descoberta Científica Computacional|Agente Racional|Construção Interativa de Teorias|Artificial Intelligence|Computational Scientific Discovery|Rational Agent|Interactive Construction of Theories";"UFCG";"masterThesis";"openAccess";"2002";"http://dspace.sti.ufcg.edu.br:8080/jspui/handle/riufcg/4773";"masterThesis";"por"
"UFCG_28a3695ba1b7ad3fb159b86d70852980";"Aprendizagem de máquina em um ambiente para negociações automatizadas.";"primary[OLIVEIRA, Rômulo Nunes de.(http://lattes.cnpq.br/8255133166870232)]";"Aprendizagem de Máquina|Negociação Automatizada|Inteligência Artificial|Redes Neurais|Modelos Computacionais e Cognitivos|Machine Learning|Automated Trading|Artificial Intelligence|Neural Networks|Computational and Cognitive Models";"UFCG";"masterThesis";"openAccess";"2006";"http://dspace.sti.ufcg.edu.br:8080/jspui/handle/riufcg/4816";"masterThesis";"por"
"UFCG_63c6197c6dc3903a04ede980895cd786";"Posicionamento inteligente de um manipulador robótico.";"primary[FERREIRA, Cristiany de Nazaré Moscoso do Amaral.(http://lattes.cnpq.br/9438925395651250)]";"Inteligência Artificial|Controle Inteligente|Robótica|Robôs Manipuladores|Robô AUTOXAD|Robótica - Garras|Lógica Fuzzy|Artificial Intelligence|Intelligent Control|Robotics|Handling Robots|AUTOXAD Robot|Robotics - Claws|Fuzzy Logic";"UFCG";"masterThesis";"openAccess";"1999";"http://dspace.sti.ufcg.edu.br:8080/jspui/handle/riufcg/6734";"masterThesis";"por"
"UFCG_88cd0bc129624d1d18b350b5c4ed58ef";"Aquisição indutiva de conhecimento contemplando os aspectos sintático, semântico, de generalização e custo.";"primary[ALEXANDRE, Cláudio Reginaldo.(http://lattes.cnpq.br/3012452088561496)]";"Inteligência Artificial|Circuitos VLSI Standard - cells|Sistemas Especialistas|Algoritmos|Engenharia do Conhecimento|Aquisição de Conhecimento|Artificial Intelligence|Standard VLSI Circuits - cells|Expert Systems|Algorithms|Knowledge Engineering|Knowledge Acquisition";"UFCG";"masterThesis";"openAccess";"1994";"http://dspace.sti.ufcg.edu.br:8080/jspui/handle/riufcg/8959";"masterThesis";"por"
"UFCG_a8dfec976b50425be9ae71867638d73a";"Interpretabilidade de redes neurais convolucionais com estudo de caso em diagnóstico por imagem.";"primary[MAIA, Matheus Gomes.(http://lattes.cnpq.br/5915606893493967)]";"Inteligência artificial|Redes neurais convolucionais|Interpretabilidade de redes neurais convolucionais|Diagnóstico por imagem|Artificial intelligence|Convolutional neural networks|Interpretability of convolutional neural networks|Diagnosis by image";"UFCG";"masterThesis";"openAccess";"2022";"http://dspace.sti.ufcg.edu.br:8080/jspui/handle/riufcg/27363";"masterThesis";"por"
"UFCG_69794ad2e56796c1b022e01986308f4e";"Desenvolvimento de soft sensor para predição do estado térmico do ferro gusa em alto-forno usando fuzzy c-médias e modelo exógeno auto-regressivo não linear.";"primary[FONTES, Diane Otília Lima.(http://lattes.cnpq.br/7291647618783834)]";"Estado Térmico|Alto Forno|Soft Sensor|FCM|NARX|Inteligência Artificial|Redes Neurais|Thermal State|Blast Furnace|Artificial Intelligence|Neural Networks";"UFCG";"masterThesis";"openAccess";"2020";"http://dspace.sti.ufcg.edu.br:8080/jspui/handle/riufcg/15281";"masterThesis";"por"
"UFCG_80374cfce80a41ad0773907b18cd079f";"Uma abordagem para recomendação de casos de teste em projetos ágeis baseados em Scrum.";"primary[SOUZA FILHO, Ednaldo Dilorenzo de.(http://lattes.cnpq.br/4483720738278386)]";"Engenharia de Software|Sistemas de Recomendação|Reuso de Software|Inteligência Artificial|Scrum|Métodos Ágeis|Software Engineering|Recommendation Systems|Software Reuse Artificial intelligence|Methods Agile";"UFCG";"doctoralThesis";"openAccess";"2021";"http://dspace.sti.ufcg.edu.br:8080/jspui/handle/riufcg/21343";"doctoralThesis";"por"
